{
  "name": "Development Testing Suite",
  "description": "Test suite for evaluating Copilot models on real-world development tasks using repository context",
  "models": ["gpt-4.1", "claude-sonnet-4"],
  "repositoryContext": {
    "path": "./",
    "includeFiles": ["*.ts", "*.js", "*.json"],
    "excludeFiles": ["node_modules", "dist", ".git", "*.min.js"],
    "maxFiles": 30,
    "maxFileSizeBytes": 50000,
    "languages": ["typescript", "javascript"]
  },
  "options": {
    "timeoutMs": 90000,
    "retries": 2,
    "delayBetweenTestsMs": 1000
  },
  "testCases": [
    {
      "id": "code-gen-001",
      "name": "Generate TypeScript function from description",
      "category": "Code Generation",
      "testType": "code-generation",
      "prompt": "Write a TypeScript function called `parseQueryString` that takes a URL query string (e.g., '?name=John&age=30') and returns an object with the key-value pairs. Handle edge cases like empty strings, missing values, and URL-encoded characters.",
      "expectedBehavior": "Should generate a well-typed function with proper error handling",
      "expectedPatterns": ["function", "parseQueryString", "Record<string", "decodeURIComponent"],
      "forbiddenPatterns": ["any\\s*[;\\)]", "TODO", "FIXME"],
      "tags": ["typescript", "parsing", "utility"]
    },
    {
      "id": "code-gen-002",
      "name": "Generate async data fetching hook",
      "category": "Code Generation",
      "testType": "code-generation",
      "prompt": "Create a custom React hook called `useAsyncData<T>` that handles data fetching with loading states, error handling, and automatic retry logic. Include proper TypeScript generics.",
      "expectedBehavior": "Should generate a reusable hook with proper state management",
      "expectedPatterns": ["useState|state", "useEffect|effect", "async|await", "loading|isLoading", "error|Error"],
      "tags": ["react", "hooks", "typescript", "async"]
    },
    {
      "id": "code-gen-003",
      "name": "Generate REST API endpoint handler",
      "category": "Code Generation",
      "testType": "code-generation",
      "prompt": "Write an Express.js route handler for a POST /api/users endpoint that validates the request body (name: string, email: string, age: number), creates a user, and returns appropriate status codes (201 for success, 400 for validation error, 500 for server error).",
      "expectedBehavior": "Should include input validation and proper HTTP status codes",
      "expectedPatterns": ["req|request", "res|response", "status|Status", "201|created", "400|bad"],
      "forbiddenPatterns": [],
      "tags": ["express", "api", "validation"]
    },
    {
      "id": "bug-fix-001",
      "name": "Fix race condition in async code",
      "category": "Bug Fix",
      "testType": "bug-fix",
      "prompt": "The following code has a race condition bug. Identify and fix it:\n\n```typescript\nlet cachedData: Data | null = null;\n\nasync function getData(): Promise<Data> {\n  if (cachedData) {\n    return cachedData;\n  }\n  \n  const data = await fetchFromAPI();\n  cachedData = data;\n  return data;\n}\n```\n\nMultiple concurrent calls may cause redundant API fetches.",
      "expectedBehavior": "Should implement proper synchronization using promises or locks",
      "expectedPatterns": ["Promise|promise|await", "pending|lock|mutex|once|singleton|cache"],
      "tags": ["async", "race-condition", "caching"]
    },
    {
      "id": "bug-fix-002",
      "name": "Fix memory leak in event listener",
      "category": "Bug Fix",
      "testType": "bug-fix",
      "prompt": "This React component has a memory leak. Identify and fix it:\n\n```typescript\nfunction WindowSize() {\n  const [size, setSize] = useState({ width: 0, height: 0 });\n\n  useEffect(() => {\n    const handleResize = () => {\n      setSize({ width: window.innerWidth, height: window.innerHeight });\n    };\n    window.addEventListener('resize', handleResize);\n    handleResize();\n  }, []);\n\n  return <div>Width: {size.width}, Height: {size.height}</div>;\n}\n```",
      "expectedBehavior": "Should add cleanup function to remove event listener",
      "expectedPatterns": ["removeEventListener", "return", "cleanup|unmount"],
      "tags": ["react", "memory-leak", "useEffect"]
    },
    {
      "id": "bug-fix-003",
      "name": "Fix SQL injection vulnerability",
      "category": "Bug Fix",
      "testType": "security-review",
      "prompt": "This code is vulnerable to SQL injection. Fix it:\n\n```javascript\napp.get('/users', async (req, res) => {\n  const name = req.query.name;\n  const result = await db.query(`SELECT * FROM users WHERE name = '${name}'`);\n  res.json(result);\n});\n```",
      "expectedBehavior": "Should use parameterized queries or prepared statements",
      "expectedPatterns": ["\\$\\d|\\?|parameterized|prepared|escape|placeholder|bind"],
      "forbiddenPatterns": ["\\$\\{name\\}|\\+ name \\+|'\\s*\\+\\s*name"],
      "tags": ["security", "sql-injection", "database"]
    },
    {
      "id": "refactor-001",
      "name": "Refactor callback hell to async/await",
      "category": "Refactoring",
      "testType": "refactoring",
      "prompt": "Refactor this callback-based code to use async/await:\n\n```javascript\nfunction processOrder(orderId, callback) {\n  getOrder(orderId, (err, order) => {\n    if (err) return callback(err);\n    validateOrder(order, (err, isValid) => {\n      if (err) return callback(err);\n      if (!isValid) return callback(new Error('Invalid order'));\n      processPayment(order, (err, payment) => {\n        if (err) return callback(err);\n        shipOrder(order, payment, (err, shipment) => {\n          if (err) return callback(err);\n          callback(null, { order, payment, shipment });\n        });\n      });\n    });\n  });\n}\n```",
      "expectedBehavior": "Should convert to clean async/await with proper error handling",
      "expectedPatterns": ["async", "await"],
      "forbiddenPatterns": ["callback\\("],
      "tags": ["refactoring", "async", "clean-code"]
    },
    {
      "id": "refactor-002",
      "name": "Extract reusable validation logic",
      "category": "Refactoring",
      "testType": "refactoring",
      "prompt": "Refactor this repetitive validation code into a reusable validation system:\n\n```typescript\nfunction validateUser(user: any) {\n  const errors: string[] = [];\n  if (!user.name || user.name.length < 2) errors.push('Name must be at least 2 characters');\n  if (!user.email || !user.email.includes('@')) errors.push('Invalid email');\n  if (!user.age || user.age < 0) errors.push('Age must be positive');\n  return errors;\n}\n\nfunction validateProduct(product: any) {\n  const errors: string[] = [];\n  if (!product.name || product.name.length < 2) errors.push('Name must be at least 2 characters');\n  if (!product.price || product.price < 0) errors.push('Price must be positive');\n  if (!product.sku || product.sku.length !== 10) errors.push('SKU must be 10 characters');\n  return errors;\n}\n```",
      "expectedBehavior": "Should create a schema-based or functional validation system",
      "expectedPatterns": ["schema|validator|rule|validate|Validator|Schema|Rule"],
      "tags": ["refactoring", "validation", "dry"]
    },
    {
      "id": "test-gen-001",
      "name": "Generate unit tests for utility function",
      "category": "Test Generation",
      "testType": "test-generation",
      "prompt": "Write comprehensive unit tests for this function using Jest:\n\n```typescript\nfunction debounce<T extends (...args: any[]) => any>(\n  func: T,\n  waitMs: number\n): (...args: Parameters<T>) => void {\n  let timeoutId: NodeJS.Timeout | null = null;\n  \n  return (...args: Parameters<T>) => {\n    if (timeoutId) {\n      clearTimeout(timeoutId);\n    }\n    timeoutId = setTimeout(() => {\n      func(...args);\n      timeoutId = null;\n    }, waitMs);\n  };\n}\n```\n\nInclude tests for: basic debouncing, multiple rapid calls, clearing timeout, argument passing.",
      "expectedBehavior": "Should generate comprehensive test cases with proper mocking",
      "expectedPatterns": ["describe", "it|test", "expect", "jest.useFakeTimers|setTimeout"],
      "tags": ["testing", "jest", "unit-tests"]
    },
    {
      "id": "test-gen-002",
      "name": "Generate integration test for API endpoint",
      "category": "Test Generation",
      "testType": "test-generation",
      "prompt": "Write integration tests for this Express endpoint using supertest:\n\n```typescript\napp.post('/api/login', async (req, res) => {\n  const { email, password } = req.body;\n  \n  if (!email || !password) {\n    return res.status(400).json({ error: 'Email and password required' });\n  }\n  \n  const user = await findUserByEmail(email);\n  if (!user || !(await verifyPassword(password, user.passwordHash))) {\n    return res.status(401).json({ error: 'Invalid credentials' });\n  }\n  \n  const token = generateToken(user);\n  res.json({ token, user: { id: user.id, email: user.email } });\n});\n```\n\nTest: successful login, missing fields, invalid email, wrong password.",
      "expectedBehavior": "Should test all status codes and edge cases",
      "expectedPatterns": ["supertest|request|fetch", "200|401|400|status", "expect|assert"],
      "tags": ["testing", "integration", "api"]
    },
    {
      "id": "doc-001",
      "name": "Generate JSDoc documentation",
      "category": "Documentation",
      "testType": "documentation",